id,name,country,date,description,total_affected,total_injured,total_missing,total_displaced,economic_impact,total_damaged_houses,total_damaged_schools,total_damaged_health_facilities
49713,Rwanda: Floods - Dec 2019,Rwanda,2019-12-06T00:00:00+00:00,"On 6th and 7th December 2019, extensive floods were observed along Nyabarongo river and its affluents in **Ngororero** district, damaging crops in Matyazo, Muhanda, Shyira and Kabaya sectors with maximum recorded rainfall at 60.8mm. For **Gisagara** district, four sectors were affected, namely Mamba, Gishubi, Kansi and Muganza, with maximum recorded rainfall at 35.6mm. In **Rusizi** district, the sectors of Bugarama Butare, Gitambi, Gikundamvura, Muganza, Mkungu and Nyakabuye were affected with maximum recorded rainfall at 44.9mm. According to the initial assessments conducted by the Ministry of Emergency Management (MINEMA) and Rwanda Red Cross Society (RRCS) on 7-9 December, it is estimated that approximately **5,360 people (1,072 households)** have been affected as a result of these floods. Sixteen people were reported to have died and 33 were injured. In addition, a total of 1,016 hectares of crops grown up in the marshlands and the swamps near the rivers were damaged and, in most cases, completely destroyed. Three water supply systems in Rusizi District (one in Gitambi and 2 in Muganza sectors) were also destroyed. ([IFRC, 3 Jan 2020](https://reliefweb.int/node/3462628))

Heavy rain continued to affect central Rwanda (particularly the Kigali and the Southern Provinces) over the past 72 hours, triggering floods and mudslides. Media report, 19 fatalities (14 in the capital Kigali and 5 in southern provinces). Media report 8 injured people, 98 houses destroyed, 3 roads and 2 bridges damaged. Over the next 24 hours, more rain and thunderstorms are forecast over the whole country, with locally heavy rain over the Kigali and southern provinces. ([ECHO, 5 Feb 2020](https://reliefweb.int/node/3508764))    

Since the beginning of November 2019, Rwanda has increasingly experienced heavy rains, affecting most parts of the country. As a result, many rivers across the country received huge levels of rainwater and overflew along their courses, causing flooding in Ngororero, Nyabihu, Nyamasheke and Rusizi districts in Western province, Musanze and Rulindo districts in Northern Province, and Gisagara district in Southern province. In December 2019 3,000 people were estimated to have been in evacuation centres and most of them still do not have shelter due to the disaster. More recently, from 3rd to 5th of March 2020, extensive flooding and windstorm were registered in Gisagara District and observed in other districts including Gasabo in Kigali City, Gisagara, Ngoma and Nyagatare District in Eastern Province. This led to extensive destruction of houses and crops...According to the initial assessments conducted by the Ministry of Emergency Management (MINEMA) and Rwanda Red Cross Society (RRCS) from 3rd to 5th March, it is estimated that approximately 5,220 people (1,044 households) have been affected as a result of these floods and accompanying windstorm. ([IFRC, 14 Mar 2020](https://reliefweb.int/node/3564148))",0,0,0,0,0,0,0,0
49603,Burundi: Floods and Landslides - Dec 2019,Burundi,2019-12-04T00:00:00+00:00,"In the night of 4 to 5 December, 26 people died and over 500 people were affected by torrential rains and landslides which caused devastation in the northwestern provinces of Cibitoke, Bubanza, and the northeastern province of Cankuzo. The death toll and number of people displaced is expected to rise in the days ahead as further information is received and verified from affected areas. ([OCHA, 6 Dec 2019](https://reliefweb.int/node/3431408))

On December 5th, torrential rains and strong winds triggered flash floods, mudflows and landslides over at least a dozen hills around Nyempundu, Mugina Commune, Cibitoke Province. A total of 9,935 people has been affected, of which 1,081 (206 households) have been displaced and temporarily relocated in communal spaces (churches and schools) and/or hosted by community members. Twenty-seven (27) people have been reported dead, while ten people are still missing. Seven people have been injured and evacuated to the Cibitoke referral hospital. Six of them have been discharged. Crops have been destroyed, livestock killed, and more than nine water access points have been washed away. ([IFRC, 30 Dec 2019](https://reliefweb.int/node/3459128))

The continuous waves of rainfall occurring in the same areas are gradually increasing the damage toll. 3 people died, 19 injured, and more than 11,000 were displaced as a result of floods in Gatumba, Buterere, Kinama and Bubanza from 28 to 29 January 2020. ([OCHA, 11 Feb 2020](https://reliefweb.int/node/3516669))     

Over the last 10 days, heavy rain has been affecting several provinces of the country, causing widespread floods and leading to casualties. According to [IOM], 1 person died in Rumonge and another one is missing in Bujumbura Mairie. Almost 700 people were displaced and more than 1,600 affected across four provinces (Gitega, Ruyigi, Bujumbura Mairie and Rumonge). ([ECHO, 26 Mar 2020](https://reliefweb.int/node/3578103))",0,0,0,0,0,0,0,0
49518,Djibouti: Floods - Nov 2019,Djibouti,2019-11-21T00:00:00+00:00,"Since 21 November, Djibouti has experienced heavy rains which triggered flash floods across the country. In Djibouti city alone, initial estimates indicate that over 30,000-40,000 families (150,000-250,000 people) have been somewhat affected by the floods, and 9 people (7 children) have reportedly been killed. Reports indicate that between 21 and 24 November, almost 300mm of rain were recorded in Djibouti city alone, or over three times the annual average. Dwellings, shops, schools and infrastructure have been damaged. In some neighborhoods, access to electricity was also interrupted. In other areas of the country, damages to roads and flash floods have affected access to several communities, and information available to date indicate that at least 300 families are now in need of urgent humanitarian assistance in Tadjourah region alone. The recently inaugurated Tadjourah-Balho road, and road between Djibouti and Tadjourah suffered severe damages. A bridge in Arta area (PK53) is in danger of collapsing. ([UNCT Djibouti/Gov't of Djibouti, 24 Nov 2019](https://reliefweb.int/node/3409423))


 Some 250,000 people have been affected countrywide (26% of the population), and 150,000 (including migrants and refugees) are in need of immediate humanitarian assistance. In Djibouti city alone, 200,000 were affected (21% of the total population) and 120,000 require immediate relief support. Some 10 people (7 children) have reportedly been killed. Floods also caused widespread destruction of infrastructure, homes and livelihoods. ([UNCT Djibouti/Gov't of Djibouti, 05 Dec 2019](https://reliefweb.int/node/3426433))


Heavy rains fell between 21 and 28 November 2019 with a peak between 22 and 23 November in Djibouti. The equivalent of two years of precipitation occurred in one day. New rains between 7 and 10 December made access to the affected areas more difficult. 11 people (including 7 children) lost their lives due to flooding and a landslide due to heavy rainfall. ([UNCT Djibouti/Gov't of Djibouti, 17 Dec 2019](https://reliefweb.int/node/3444263))
### Key Content

- [![Govt. Djibouti: 2019 Flash Floods Humanitarian Needs Rapid Assessment - Cover preview](https://reliefweb.int/sites/default/files/styles/small/public/previews/6e/6c/6e6c1848-8eea-3437-8ad1-e2211fc51a02.png) Govt. Djibouti: 2019 Flash Floods Humanitarian Needs Rapid Assessment](https://reliefweb.int/node/3426433)",0,0,0,0,0,0,0,0
49333,Kenya: Floods and Landslides - Oct 2019,Kenya,2019-10-24T00:00:00+00:00,"Heavy rain has been affecting several counties since last week, causing flash flooding and landslides. According to media reports, as of 24 October, 9 people have died as a result, 4 in Elgeyo-Marakwet County, 4 in Wajir county and 1 in Turkana County. Thousands of people have been displaced and roads and houses have been damaged. ([ECHO, 24 Oct 2019](https://reliefweb.int/node/3362578))    

[H]eavy rain has affected large areas over the last week, causing flash flooding and landslides. The northern and north-eastern counties are most affected; as of 24 October, at least 21 people have died, thousands have been displaced, and houses, roads and other infrastructure have been damaged. The Kenya Meteorological Department has warned of continued, countrywide heavy rain and strong winds over the coming days. Further severe flooding is predicted, particularly along the Tana River. ([ECHO, 26 Oct 2019](https://reliefweb.int/node/3365658))

Based on data from Kenya Red Cross staff and volunteers a total of 14,083HHs (approx. 84,367 people) have been affected, 21 deaths reported with 2 others injured. The number of displaced households is currently estimated at 6,000HHs. In addition, 531 acres of farmland have been destroyed and 21,675 livestock have been washed away. Assessments are continuously ongoing with a possibility of a significant increase in the number of affected populations. ([IFRC, 29 Oct 2019](https://reliefweb.int/report/kenya/kenya-floods-emergency-plan-action-dref-n-mdrke045))

Heavy rainfall in many regions of Kenya since the start of the short rains season in early October has led to riverine and flash floods, rock falls, mudslides and landslides. More than 101,000 people have been affected, mainly in the north-eastern, central, and coastal regions, according to the Kenya Red Cross Society (KRCS). The KRCS has confirmed that at least 14,000 people have been displaced who were living in low-lying areas where rivers have burst their banks. At least 29 flood-related deaths have been reported and the death toll and number of people displaced is expected to rise in the days ahead as further information is received and verified from affected areas.([OCHA, 30 Oct 2019](https://reliefweb.int/node/3371203))

43,000 people have been affected in Wajir County (north-east Kenya) and the number of flood-related deaths has increased to 29. Approximately 36,000 people have been displaced, more than 101,000 affected, 52 schools and 14 facilities are inaccessible. Roads are flooded and two bridges damaged, including the main bridge linking Tanzania and Kenya. ([ECHO, 31 Oct 2019.](https://reliefweb.int/node/3372783))

More than 144,000 people in 25 counties across the country are estimated to be affected by riverine and flash floods, rock falls, mudslides and landslides, according to the Kenya Red Cross Society (KRCS). The Government’s National Disaster Operation Centre (NDOC) also confirmed that at least 17,000 people have been displaced and 48 died due to the floods. With the current weather forecasts, which predicts heavy rains until the end of November, the NDOC expects these numbers to rise, including affecting 200,000 refugees living in settlements in Dadaab. ([OCHA, 5 Nov 2019](https://reliefweb.int/node/3383388))

Kenya Red Cross teams in various parts of the country are supporting the evacuation of families to safer areas. Working alongside the Government of Kenya, Red Cross teams are delivering emergency relief items and essential supplies like household and sanitation items in evacuation centres hosting those who have been displaced by the flooding. Areas affected by flooding so far include Marsabit, Wajir, Mandera, Tana River, Turkana, Elgeiyo Marakwet, Kitui, Meru, Kajiado, Nandi, Kwale, Garissa, Muranga and Busia. ([IFRC, 25 Nov 2019](https://reliefweb.int/node/3409233))

Heavy rain has been affecting western Kenya, triggering landslides that have resulted in casualties and widespread damage. As of 26 November, at least 52 fatalities after major landslides occurred on 24 November in Tapach, Weiwei and Batei Wards Villages (West Pokot County). Around 45 people are reportedly still missing ([ECHO, 26 Nov 2019.](https://reliefweb.int/node/3411513))

More than 160,000 people, including nearly 18,000 who are displaced countrywide, have been affected by floods or landslides since the onset of the short rains in October, according to the Kenya Red Cross Society (KRCS). At least 120 people have reportedly died, including 72 people who lost their lives after a landslide buried their houses in West Pokot County in northwestern Kenya, according to the Government. Infrastructure of undetermined value, including roads and bridges, have been damaged, hampering effective humanitarian response efforts in affected areas ([OCHA, 27 Nov 2019.](https://reliefweb.int/node/3413733))

UNICEF has sent supplies in response to the heavy rains and floods experienced in Kenya since mid-October, bringing relief to around 130,000 affected people. According to the Government spokesman, 330,000 people have been affected, 17,000 displaced and 132 died, due to floods and landslides. Damage to essential infrastructure including roads, schools and health facilities has disrupted access to critical services for children and families. ([UNICEF, 4 Dec 2019](https://reliefweb.int/node/3439748))


From October to December, Kenya experienced one of the wettest short rains seasons on record, with rainfall totals ranging up to 400 percent of average. A second round of floods and landslides in November caused the death of 132 people, displaced 17,000 people, and affected approximately 330,000 people, primarily in West Pokot. Disruptions to critical transport infrastructure and ongoing delays in the unimodal harvest have reduced the availability of food in markets, sustaining high food prices. In localized areas, crop and livestock losses have been reported. ([FEWSNET, 29 Dec 2019](https://reliefweb.int/node/3458268/))",0,0,0,0,0,0,0,0
49293,Somalia: Floods - Oct 2019,Somalia,2019-10-18T00:00:00+00:00,"Moderate to heavy rains continued in many parts of Somalia and within the Ethiopian highlands over the last one week. River levels at Belet Weyne (Shabelle) are currently very high and the trend is expected to continue reaching over bank in the coming few days. Along Juba, the river levels are also high. The cumulative rainfall forecast for the coming week is calling for moderate to heavy rains across the country as well as the Ethiopian highlands. The river levels will therefore continue to rise with a high risk of flooding along the entire two channels. Flash floods are expected in built-up and low lying areas of Bay, Bakool and central regions given the forecast. ([FAO, 18 Oct 2019](https://reliefweb.int/node/3354633))     

Latest reports received in the evening of 21 October indicate that nearly 40 per cent of Belet Weyne town has been affected by flooding with an estimated 72,000 people having moved to Ceel Jaale highlands and surrounding areas. All villages in the north of Belet Weyne town have been affected and humanitarian partners are yet to establish the number of people displaced in these areas. The situation is further compounded by flooding from an outburst of minor tributaries in Belet Weyne, which has caused damage to farmland in villages such as Hawo Taako. Significant portions of crop land were also flooded in Bardheere in Gedo region, (where the river is already at bank full) and Bualle. Riverine communities have been asked to vacate their homes to higher ground with immediate effect. The rains will continue in the next seven days and river levels will continue to rise, further worsening the flood situation. ([OCHA, 21 Oct 2019](https://reliefweb.int/node/3357638))

Riverine and flash flooding has affected populations in middle and lower Juba, Bay, lower and middle Shabelle, and Hiraan states. The number of people affected is expected to be high; an initial 76,000 people have been displaced so far in the worst affected areas. The impact of the rains will have on food security is not yet clear. ([ACAPS, 24 Oct 2019](https://reliefweb.int/node/3362883))

An estimated 182,000 people have been displaced thus far due to flooding, according to UNHCR-Protection Return Monitoring Network (PRMN). Farmland, infrastructure and roads have been destroyed, and livelihoods disrupted in some of the worst-hit areas.([OCHA, 28 Oct 2019](https://reliefweb.int/node/3367018))

As of 5 November, 547,000 people have been impacted of whom 370,000 are displaced. In Belet Weyne district, an estimated 45,500 households (273,000 people) have fled their homes. Farmland, infrastructure, and roads have been destroyed in some of the worst-hit areas in Hirshabelle, Jubaland and South West States. At least 17 deaths have been reported. ([OCHA, 06 Nov 2019](https://reliefweb.int/node/3381378))

Humanitarian partners have scaled up flood responses by re-programming available resources, but significant gaps remain even as heavy rains subside in some locations. More than 350,000 people have received assistance out of 570,000 flood-affected people. In Belet Weyne, flood water has receded, allowing 80,000 displaced people in Belet Weyne town (40 per cent of 180,000 displaced town residents) to return home. The rains have inundated 207,000 hectares of land along Shabelle and Juba rivers, raising concerns about food security and livelihood losses. On 23 November, the UN and Government launched a 3-month US$72.5 million Flood Response Plan to mobilise additional resources. Some $25 million has been made available - $11 million from the Somalia Humanitarian Fund, $8 million from CERF and funding from ECHO and DFID, but $47.5 million is still required. ([OCHA, 5 Dec 2019](https://reliefweb.int/node/3425778))    

The Tropical Storm (TS) initially named SIX that developed in the northern Indian Ocean has now been assigned the name PAWAN after sustaining a speed of more than 39 miles per hour for two days. ([FAO, 6 Dec 2019](https://reliefweb.int/node/3427818)) 

Heavy rain in the last 5 days has affected northern, central and coastal Somalia. On 7 December, Puntland coast was affected by Tropical Storm PAWAN and 2 people died following floods in Las Qoray (Sanaag Region). Roads connecting the town to the rest of the region have been damaged. In central Somalia, the overflow of the River Shabelle flooded Afgooye district, displacing over 1,500 people. ([ECHO, 10 Dec 2019](https://reliefweb.int/node/3433628))

According to the Humanitarian Affairs and Disaster Management Agency (HADMA), some 35,600 people in Puntland have been affected by TC Pawan and the consecutive heavy rains which accompanied the tropical cyclone. ([IFRC, 20 Dec 2019](https://reliefweb.int/node/3452248))

River floods and flash floods from excessive rainfall have caused moderate damage to crops, especially in riverine livelihood zones. In urban Beletweyne, where floods have disrupted livelihoods and caused large population displacement, significant humanitarian assistance is currently preventing targeted households to meet minimally adequate food consumption requirements. ([FEWSNET/FSNAU, 27 Dec 2019](https://reliefweb.int/node/3457643))",0,0,0,0,0,0,0,0
49388,Uganda: Floods and Landslides - Oct 2019,Uganda,2019-10-17T00:00:00+00:00,"Hundreds of people have been left homeless in Butaleja and Bulambuli districts in eastern Uganda following ongoing heavy rains. According to the Uganda Red cross Society, an assessment conducted by the humanitarian movement shows that many houses are submerged in water and Lelesi Bridge almost washed away as many roads are cut off. Over 1,000 people have been affected with some of the most affected sub counties being Bulambuli Town Council, Nabongo, Siimu, Great Bukhalu, Bunalwire and Bwanyanga ([Monitor, 19 Oct 2019.](https://reliefweb.int/node/3356233))

In Uganda, 3 deaths were reported in Kasese District (Western Region). Around 950 households were affected, approximately 100 homes destroyed and several others damaged in eastern and western regions due to the Manafwa River overflow ([ECHO, 23 Oct 2019.](https://reliefweb.int/node/3360643))

Since mid-October, continuous heavy rainfall in Bulambuli and Butaleja districts near Mount Elgon, Eastern Uganda, have caused severe flooding and triggered some mudslides. At least 950 houses have been flooded, leaving more than 4,500 people in need of shelter. Critical infrastructure, including roads, bridges and schools has been damaged and/or destroyed. Some schools have been temporarily closed. ([ACAPS, 4 Nov 2019](https://reliefweb.int/node/3377543/))

According to media reports, as of 6 November, one person died and 2 people are missing following flooding in Mukono District. In Bulambuli and Butaleja districts, 4,500 people have been displaced, 950 houses flooded and schools, roads and bridges damaged or destroyed. ([ECHO, 6 Nov 2019.](https://reliefweb.int/node/3381893))

More than 900 houses to resettle about 7,200 out of the 100,000 landslide victims will be constructed on 2,800 acres. In the first phase, 101 houses were constructed and about 720 people were relocated from the landslide affected districts ([Monitor, 11 Nov 2019.](https://reliefweb.int/node/3389353/))

The Uganda Red Cross Society (URCS) has developed a three (3) months integrated emergency preparedness and response plan to respond and mitigate impacts of anticipated adverse weather events; including flooding and landslides arising from torrential rainfall that has affected over 10 districts; as well as response to confirmed cholera outbreaks in the four districts of Busia, Bududa, Kyegegwa and Isingiro. ([Uganda Red Cross, 29 Nov 2019](https://reliefweb.int/node/3417318))     

[F]looding and landslides have impacted at least 12 districts, including Bundibugyo District, where more than 4,000 people were affected. ([OCHA, 4 Dec 2019](https://reliefweb.int/node/3424503))

Several landslides, triggered by heavy rains occurred across eastern Uganda, leading to fatalities and damage. A landslide occurred on 4 December in Bubuda District (Eastern Region of Uganda), where at least five people died, 48 are still missing, and over 200 families are affected, as reported by the Government of Uganda. Most of the roads and bridges in the districts are reportedly flooded, while search and rescue operations are hindered by shortage of personnel and equipment. Several landslides and floods were reported in Sironko District (Eastern Region of Uganda), where the Sironko river broke its banks. According to the Uganda Red Cross Society, at least five people are dead and over 200 are displaced in Zesui and Masaba sub-counties. Moderate to locally heavy rains will persist over southern areas of the Country on 7-8 December. ([ECHO, 6 Dec 2019](https://reliefweb.int/node/3428523))

Heavy rain has affected western, eastern and northern regions causing floods and landslides. 36 people died, 22 in Bundibugyo District. Up to 6,000 people are displaced in Bududa District alone. 
The refugees’ transit centre in Bundibugyo District will host up to 700 internally displaced Ugandan nationals. Facilities are already overstretched and a new refugee influx from the DRC, linked to recent clashes in Ituri, may further exacerbate the situation.([ECHO, 10 Dec 2019](https://reliefweb.int/node/3433633/))

Torrential rains are being experienced across Uganda. According to the Uganda National Meteorological Department (UNMA), abovenormal rains will continue until the end of the year. At least 38 people have died due to floods and landslides in Bundibugyo, Bududa and Sironko districts, and over 150 people have been injured. At least 300,000 have been affected and an estimated 65,000 people are displaced, according to Government sources. The floods and landslides have left a trail of destruction, including damaged homes, infrastructure, agriculture and livelihoods ([OCHA, 19 Dec 2019.](https://reliefweb.int/node/3448808))",0,0,0,0,0,0,0,0
49373,Tanzania: Floods - Oct 2019,United Republic of Tanzania,2019-10-16T00:00:00+00:00,"Heavy rain has been affecting central and northern Tanzania since the beginning of October, causing flooding and river overflow. As of 16 October, the number of fatalities increased to 18, of which 11 in Morogoro Region and significant damage to houses, infrastructure and crops. ([ECHO, 16 Oct 2019](https://reliefweb.int/node/3351103))

According to media reports, 14 people died in Handeni district (Tanga Region). Since mid October, several floods have led to a total death toll of 44. In addition, a number of houses, roads, bridges and crop farms have been damaged. ([ECHO, 28 Oct 2019](https://reliefweb.int/node/3366983))

As of 31st October, Mara is one of the most affected regions hit by heavy rains between October 26th and 28th and particularly the district of Rorya and Musoma Rural. The Emergency Needs Assessments conducted by TRCS National Disaster Response Team (NDRT)’ members in coordination with Local Authorities in these districts between October 29th and 31st, reported that rains coupled with strong windstorms affected 1,113 people (292 HH), including 50 injured. Several homes and infrastructure, including roads, classrooms and bridges were either destroyed or damaged, as well as several livestock and small stocks, in addition to 370 acres of crop farms which were washed away. TRCS is seeking CHF 83,430 from the IFRC Disaster Relief Emergency Fund (DREF) to meet the immediate needs of the flood affected population in Rorya and Musoma Rural districts in Mara region. ([IFRC, 15 Nov 2019](https://reliefweb.int/node/3398913/))

In Tanzania, the death toll is over 50, including 10 people who were drowned by a flood-swollen river. ([OCHA, 04 Dec 2019](https://reliefweb.int/node/3424503/))",0,0,0,0,0,0,0,0
