id,name,country,date,description,total_affected,total_injured,total_missing,total_displaced,economic_impact,total_damaged_houses,total_damaged_schools,total_damaged_health_facilities
48389,Sudan: Floods - Jun 2019,Sudan,2019-06-04T00:00:00+00:00,"On 7 June, torrential rains reportedly destroyed around 300 to 400 houses belonging to IDPs and returnees in Leiba, East Jebel Marra, South Darfur. A total of 11 people were injured including two who were in critical situation. Two schools, health facility and latrines were also damaged. HAC and humanitarian partners plan to conduct a rapid assessment this week to support the affected people...On 4 June, heavy rain and flooding have either partially or completely destroyed IDPs’ houses in Tawilla, North Darfur. Preliminary assessments indicate that over 480 houses (about 2,470 individuals) have completely been destroyed and 758 houses have partially been affected in all five Tawilla IDP camps. Also, close to 900 latrines have been destroyed across the camps. On 11 June 2019 humanitarian partners will assess the needs of the population affected by flooding and rains in the area and plan the response. ([OCHA, 9 Jun 2019](https://reliefweb.int/node/3162664))     

Humanitarian partners have started providing support to people affected by flooding in Tawilla, North Darfur. WFP and UNHCR provided a 15-days emergency food ration and non-food items respectively. Approximately 485 households (2,472 people) were completely destroyed, 758 houses (3,726 people) partially destroyed and 899 latrines affected. The most urgent needs identified in an inter-agency assessment on 11 June were shelter and NFIs, food, health and opening the drainage systems in Tawilla. ([OCHA, 13 Jun 2019](https://reliefweb.int/node/3169844))    

In response to flooding in Kebkabiya, a rapid needs assessment for the affected households was conducted by the national NGO KSCS; NFIs request has been submitted to UNHCR. In Tawilla, multi-sectoral humanitarian assistance has been provided to 6,198 individuals including NFI and WASH supplies; 15-day emergency food rations. Plans are in place to rehabilitate damaged latrines. Health sector is conducting health surveillance, and has dispatched ermergency health kits to cover 15,000 people. The education sector is sending education supplies for two affected basic schools. In Leiba, response is underway to support the 325 affected families.  ([OCHA, 20 Jun 2019](https://reliefweb.int/node/3180774))

Heavy rain has continued to cause flash flooding across 16 out of 18 states in Sudan, resulting in 78 casualties across the country. So far an estimated 346,300 people have been affected by these floods, with more than 41,000 homes destroyed and almost 28,000 damaged. The majority of people affected require emergency shelter and non-food items (ES/NFIs), water, sanitation and hygiene (WASH) services, food, health, vector control and draining of stagnant water as the risk of water-borne disease outbreaks is high. Various government authorities and humanitarian partners are currently responding to needs. ([ECHO, 6 Sep 2019](https://reliefweb.int/node/3291408))

The total number of people affected by floods and in need of assistance is increasing slightly as  water dries up, mainly in Al Salam and Tandalti localities in White Nile State. In areas where humanitarian actors are not present, HAC and national actors are trying to meet needs, but response is hampered by limited relief supplies, funding or staff. The main need of all people affected by floods are emergency shelter and household supplies (ES/NFIs) ([OCHA, 12 Sep 2019.](https://reliefweb.int/node/3301268))

As of 19 September 2019, an estimated 364,200 people have been affected by heavy rains and flash floods across 17 states and the Abyei area*, according to HAC and partners. HAC has reported 78 related deaths, mainly due to collapsed roofs and electrocution. In total 45,104 homes have been destroyed and 27,742 homes damaged. ([OCHA, 3 Oct 2019.](https://reliefweb.int/node/3332233))",0,0,0,0,0,0,0,0
48454,Uganda: Floods and Landslides - Jun 2019,Uganda,2019-06-04T00:00:00+00:00,"The landslides in Bududa District were triggered by a heavy and continuous downpour experienced from the night of 4th June, 2019 until the morning of 5th June, 2019. The landslides hit several sub-counties with most affected being Buwali and Bukalasi/Bundesi, Bumayoka and parts of Bubiita in the lower stream being affected by flash floods. As a direct consequence of these heavy rains, a total of four (4) major landslides occurred in Bududa: one in Bumayoka subcounty, one in Bukalasi/ Bundesi and two in Buwali. The landslides caused six (6) deaths, and injuries to 27 persons (13 males & 14 females) with all still admitted at Bududa Hospital. Amongst the injured, two (2) are children under 5 years (1 male and 1 female). First rapid assessments identified eighty (80) households as displaced (480 people), out of the 100 affected households and 669 people affected. In the neighbouring Sironko District, along the Mount Elgon slope, a devastating flood incident occurred in Buyobo Sub-County on 4th of June at around 4:00am. The continuous rains that started at 2:20am and continued consecutively for hours triggered flooding from uphill, which carried a huge mass of soil down the hills into river Bugibuni, prompting it to burst its banks and causing havoc to the communities downhill. The river carried massive water, logs of huge trees, soil debris down the slope and swept off houses and crops adjacent to it. The flash floods damaged houses of 111 households, with a population of 426 persons. Fortunately, no deaths were registered. Crops, merchandise, animals and properties worth millions of shillings were destroyed by the floodwaters. ([IFRC, 24 Jun 2019](https://reliefweb.int/node/3184104))

Several landslides and floods across Bulambuli District (eastern Uganda) have resulted in 1 death and 19 missing. The most affected areas include Nabiwutulu, Gimadu Bugatiisa, and Buluganya Counties. The Uganda Red Cross Society is conducting an assessment to establish magnitude of the disaster and the needs of the people affected. Eastern Uganda was already affected by a series of landslides in early June this year, when at least 5 died. Moderate to locally heavy rain is forecast across most of Uganda on 2-3 September. ([ECHO, 2 Sep 2019](https://reliefweb.int/node/3284463))",0,0,0,0,0,0,0,0
48268,Tanzania: Floods - May 2019,United Republic of Tanzania,2019-05-08T00:00:00+00:00,"Heavy rains were reported in Dar es Salaam, starting on 8 May 2019 to-date. According to the Tanzania Meteorological Agency (TMA), these rains are a result of the Inter-Tropical Convergence Belt and led to continous rainfall and resulting flooding which peaked on 13 May 2019. According to IGAD Climate Prediction Application Centre (ICPAC), much of southern and eastern Tanzania recorded wetter than normal rainfall condition with a few places in southern and eastern Tanzania recording severely to extremely wet rainfall conditions between 1st and 10th May 2019. On 23rd May 2019, the TMA issued a weather information update stating that rains will continue with significant impact; floods, fishing activities to be interfered, transport network impaired, socioeconomic/ livelihood will be damaged and increased risk of waterborne and vector borne disease outbreak.

The floods caused a significant impact to the people in Dar es salaam leading to damage of properties and livelihoods and putting the affected population at risk of diseases. The initial rapid assessment conducted by TRCS from May 20 to May 23rd, indicated that the heavy rains have caused serious flooding in Kinondoni, Temeke and Ilala municipalities of Dar es Salaam. The rains which fell upstream affected eight (8) out of twenty-seven (27) wards of Kinondoni municipality, eleven (11) out of twenty-four (24) Wards of Temeke municipality and eight (8) out of twenty-five (25) Wards of Ilala municipality.

The flooding has caused displacement of people, who are hosted by friends as well as in temporary public buildings, mainly schools, mosques and churches. A total of 1215 HH have been displaced (from the 1560 HH affected). There is a widespread destruction of physical infrastructure, particularly roads and bridges, some of which have been completely damaged/broken, interfering with communication between neighbouring places within and outside the municipality. The flooding has caused significant damage to houses and has swept away personal household items and belongings as well as other properties including poultry. ([IFRC, 27 May 2019](https://reliefweb.int/node/3145358))",0,0,0,0,0,0,0,0
48409,Burundi: Malaria Outbreak - May 2019,Burundi,2019-05-05T00:00:00+00:00,"Burundi is currently experiencing a high malaria burden, reaching epidemic proportions since early May 2019. Initial assessments indicate that the major drivers of the current increased malaria transmission include low use of preventive measures (coverage of long-lasting insecticidal mosquito nets stands at less than 50% after the last universal distribution campaigns in 2017); low population immunity in the wake of increased mobility, especially for the people living in the mountains where malaria transmission is usually very low; climatic changes and vector ecological and behavioural changes (increased vector density and feeding habits – biting both indoors and outdoors as well as higher vector aggressiveness)...The national malaria outbreak response plan, which is currently being validated, has highlighted a lack of human, logistical and financial resources for effective response. All stakeholders, including the national authorities and partners are called upon to provide the requisite resources to mount a robust response to this event before it escalates. ([WHO, 9 Jun 2019](https://reliefweb.int/node/3163979))     

The number of health districts that have passed the epidemic threshold has continued to increase in May. Nine health districts are above the alert threshold and thirty-three are above the epidemic threshold. The number of cases recorded since the start of the year now exceeds three million, a fifty per cent increase compared to the same period in 2018. ([OCHA, 21 Jun 2019](https://reliefweb.int/node/3184194))

In week 29 (week ending 21 July 2019), 152 243 cases including 65 deaths have been reported from 39/46 districts. There is a 164% increase in the number of cases reported in week 29 of 2019 compared to week 29 of 2018 and a 13.5% decrease in the number of cases reported in week 29 compared to week 28 of 2019. Eight more cases have been reported in week 29 compared to week 28 of 2019. From week 1 (week ending 5 January 2019) to week 29 of 2019, a cumulative total of 5 738 661 cases and 1 801 deaths (CFR 0.03%) have been reported. ([WHO, 28 Jul 2019](https://reliefweb.int/node/3236018))

Since week 48 of 2018 (week ending 2 December 2018), there has been a progressive increase in the number of malaria cases reported across the 46 districts of Burundi, with the epidemic threshold surpassed in week 18 (week ending 5 May 2019). In week 34 (week ending 25 August 2019), 109 386 cases including 66 deaths have been reported. There is a 125% increase in the number of cases reported in week 34 of 2019 compared to the same period in 2018. ([WHO, 08 Sep 2019](https://reliefweb.int/node/3295373))

The outbreak of malaria in Burundi is ongoing, with a persistent high incidence of cases across the country. [...]
From 1 January to 20 October 2019, a cumulative total of 7 233 138 malaria cases with 2 691 deaths (case fatality ratio 0.03%) have been reported across the country. A total of 23 (49%) out of the 47 health districts of Burundi have surpassed the epidemic threshold, while ten (21.4%) have reached the alert threshold. ([WHO, 27 Oct 2019](https://reliefweb.int/node/3367963))

In week 51 (week ending 22 December 2019), 152 960 cases including 63 deaths have been reported. There is a 90% increase in the number of cases reported in week 51 of 2019 compared to the same period in 2018. ([WHO, 05 Jan 2020](https://reliefweb.int/node/3464608))

After the increase in the number of malaria episodes in 2019, a progressive reduction of cases has been observed since the beginning of the year. According to the MoH surveillance data, the cumulative number of malaria cases reported during the first trimester stands at 1,442,585 (including 837 deaths) as opposed to 2.5 million within the same period in 2019. This year, an average of 131,000 cases were reported weekly in January against 109,000 in February. ([UNICEF, 28 Apr 2020](https://reliefweb.int/node/3623889))",0,0,0,0,0,0,0,0
48078,Tropical Cyclone Kenneth - Apr 2019,"Comoros, Madagascar, Malawi, Mozambique, United Republic of Tanzania",2019-04-23T00:00:00+00:00,"On 23 April, Tropical Cyclone Kenneth formed north of Madagascar and east of the Aldabra Atoll, north of the Mozambique Channel. Its path is expected to pass over the northern tip of the Comoros islands on 24 April and continue onward to northern Mozambique and southern Tanzania. It is expected to make landfall in the district of Palma in Mozambique on 25 April...The Global Disaster Alert Coordination System (GDACS) has issued an [orange alert](http://www.gdacs.org/report.aspx?eventtype=TC&eventid=1000559&episodeid=7) for the Cyclone, meaning a medium humanitarian impact is expected based on the storm strength and its forecasted path. According to [UNOSAT](https://reliefweb.int/node/3094943), the entire population of Comoros (758,339) is within the Cyclone’s windspeed zones, with Grand Comore the primary concern. In Mozambique, more than 747,000 people are living within the Cyclone’s path, mainly in Cabo Delgado Province, including a projected 117,000 living in high wind speed zones. ([OCHA, 24 Apr 2019](https://reliefweb.int/node/3096403))

The official death toll from the impact of Tropical Cyclone Kenneth in northern Mozambique has risen to 38 people, according to the Government. Nearly 35,000 houses have either been partially destroyed (32,034) or totally destroyed (2,930), according to the Government ... More than 570 mm of rain has been recorded since 25 April in Pemba, the highest in Cabo Delgado. ([OCHA, 29 Apr 2019](https://reliefweb.int/node/3103773))

More than 27,000 people have been reached with food assistance since Cyclone Kenneth made landfall on 25 April 2019. International deliveries of shelter supplies began to arrive in Pemba on 1 May 2019; more flights are scheduled in the days ahead. The number of people affected by Tropical Cyclone Kenneth has risen to more than 384,800, with an estimated 185,000 people affected in Comoros and at least 199,836 affected in Mozambique. The risk of water-borne diseases is high, with many areas still without access to clean water following the cyclone. ([OCHA, 2 May 2019](https://reliefweb.int/node/3109628))

From 9 to 17 September, in close coordination with Mozambique’s National Institute for Disaster Management (INGC), IOM DTM (Displacement Tracking Matrix) teams conducted baseline assessments at locality level (localidade), the findings were as follows:  
- All the affected population remain within the same locality;     
- More than 160,000 people whose homes were affected by shelter damage have stayed inside their locality;  
- In Cabo Delgado, reported a displaced population who have not returned to their locality of origin estimated at around 1,000 individuals and 200 households;  
- The number of returned populations who have returned to their locality of origin represents nearly 2,500 people
and around 500 households.  
([IOM,INGC, 27 Sep 2019](https://reliefweb.int/node/3324648))
### Appeals & Response Plans

- [![IFRC: Mozambique: Tropical Cyclones Idai and Kenneth - Revised Emergency Appeal MDRMZ014 Revision n° 3 - Cover preview](https://reliefweb.int/sites/default/files/styles/small/public/previews/28/50/285021ab-8fb9-3504-aecc-6c4473b8d0e2.png) IFRC: Mozambique: Tropical Cyclones Idai and Kenneth - Revised Emergency Appeal MDRMZ014 Revision n° 3](https://reliefweb.int/node/3675137)",0,0,0,0,0,0,0,0
48163,Kenya: Cholera Outbreak - Jan 2019,Kenya,2019-01-22T00:00:00+00:00,"On 22 January 2019, the Kenyan Ministry of Health notified WHO of a cholera outbreak in Narok and Kajiado Counties located along the northern border of Tanzania. The outbreak was first detected on 2 January 2019 in Narok county followed by Kajiado County one week later. Following investigations, it was determined that the initial cases started after a communal meal and the outbreak was subsequently sustained by poor water, sanitation and hygiene (WASH) conditions in the affected areas. Environmental samples collected by the investigational teams demonstrated that a river shared by both counties was contaminated by surface water runoff which was thought to be soiled by human waste due to widespread open defecation in the vicinity. ([WHO, 14 Apr 2019](https://reliefweb.int/node/3085403))     

Since January 2019, nine of the 47 Counties of Kenya reported cholera cases, namely: Kajiado, Nairobi, Garissa, Machakos, Mandera, Embu, Narok, Wajir, and Mombasa Counties. The outbreak remains active in six Counties: Nairobi, Garissa, Kajiado, Wajir, Mombasa and Machakos. From January to 14 July 2019, a total of 3433 cases including 24 deaths (CFR 0.7%) have been reported, of which 141 cases have been laboratory-confirmed. ([WHO, 21 Jul 2019](https://reliefweb.int/node/3226018))

Cholera outbreaks have also been reported with a total of 10 counties being affected since the beginning of the year. Over the same period, a total of 3,847 cases have been reported out of which 163 were confirmed. Some 26 deaths have been reported, a case fatality rate of 0.7 percent. ([IFRC, 9 Sep 2019](https://reliefweb.int/node/3307188))

In week 45 (week ending 10 November 2019), 31 new suspected cases were reported from Nairobi (22 cases), Wajir (6 cases), Garissa (3 cases). Since January 2019, 12 of the 47 Counties of Kenya reported cholera cases, namely: Embu, Garissa, Kajiado, Kisumu, Machakos, Makueni, Mandera, Mombasa, Nairobi, Narok, Turkana and Wajir Counties. The outbreak remains active in three counties: Garissa, Nairobi and Wajir.([WHO, 17 Nov 2019](https://reliefweb.int/node/3399248))

In week 51 (week ending 22 December 2019), 91 new suspected cases were reported from, Garissa (51 cases), Turkana (35 cases) Mandera (3 cases) and Kirinyaga (2 cases). Turkana county is experiencing the third wave of the outbreak this year. Since January 2019, twelve of the 47 Counties of Kenya reported cholera cases, namely: Embu, Garissa, Kajiado, Kisumu, Machakos, Makueni, Mandera, Mombasa, Nairobi, Narok, Turkana and Wajir Counties. The outbreak remains active in four counties: Garissa, Mandera, Turkana and Kirinyaga.  ([WHO, 5 Jan 2020](https://reliefweb.int/node/3464608))

In week 7 (week ending 16 February 2020), 62 new suspected cases were reported from Turkana county. Since 1 January 2020, cholera outbreak has been reported in three counties namely: Garissa, Wajir and Turkana. Cummulatively, a total of 253 cases with no deaths have been reported. The outbreak  in all the three counties is a continuous wave from 2019. The transmission is active in all the affected counties.. ([WHO, 8 Mar 2020](https://reliefweb.int/node/3557008))",0,0,0,0,0,0,0,0
47703,South Sudan: Measles Outbreak - Dec 2018,South Sudan,2018-12-23T00:00:00+00:00,"A Measles outbreak was confirmed in Abyei following laboratory confirmation of five cases in December 2018 with a total of 45 cases suspected. ([WHO, 6 Jan 2019](https://reliefweb.int/node/2953564/)) 21 cases, including 2 deaths were reported in Juba from the two payams of Kator and Amarat. ([WHO, 20 Jan 2019](https://reliefweb.int/node/2981993/)).

A reactive Measles vaccination campaign will be conducted targeting children aged 6-59 months in all payams and IDP sites in Juba starting on 11th February, 2019. ([WHO, 27 Jan 2019](https://reliefweb.int/node/2982053/))

As of 10th February 2019 Measles outbreaks had been confirmed in seven counties namely; Rumbek East, Abyei, Juba, Pibor, Gogriel West, Bor South, and Mayom.([WHO, 3 Mar 2019](https://reliefweb.int/node/3019948/))

A campaign to immunize nearly 40,000 children against measles was launched today, 6 March 2019. The campaign is being carried out by the Ministry of Health with support from [(WHO], [UNICEF] and [IOM]. It comes after a measles outbreak was recently confirmed in Mayom, former Unity State. At least 17 measles cases with no deaths have been reported in Mayom County, with nearly 90 per cent of those affected aged less than 5 years and originating from Pup and Mankien Payams. ([WHO, 6 Mar 2019](https://reliefweb.int/node/3022688/))    

Since the outbreak was declared in the country in January, campaigns have been conducted in Juba, Central Equatoria; Pibor in Jonglei; Aweil South in Northern Bahr el Ghazal; Mayom in Unity; Melut in Upper Nile; and Gogrial West and Gogrial East in Warrap. More are planned for Aweil West and Aweil Center in Northern Bahr el Ghazal; and Tonj North in Warrap. Nearly 311,000 children aged between 6 months and 15 years have been vaccinated in the areas which have been reached. A countrywide follow-up mass measles campaign targeting children aged 9-59 months is planned for November 2019, for all children who have remained unvaccinated since a 2017 campaign. ([OCHA, 20 May 2019](https://reliefweb.int/node/3137613))


Between week 1 to week 48 of 2019, a total of 3 963 suspected cases of measles which 169 laboratory-confirmed and 23 deaths (CFR 0.6%) have been reported. The outbreak has affected 16 counties and 4 Protection of Civilians Sites POCs (Juba, Bentiu, Malakal and Wau). Measles cases continue to rise in 2019 with an average of 75 cases reported per week compared to 12 cases reported at the same period in 2018. ([WHO, 5 Jan 2020](https://reliefweb.int/node/3464608/))

Between week 1 in 2019 to week 4 in 2020, a total of 4 731 suspected cases of measles which 247 laboratory-confirmed and 26 deaths (CFR 0.5%) have been reported. The outbreak has affected 23 counties ( Pibor; Abyei; Mayom; Gogrial West; Aweil South; Melut; Gogrial East; Juba; Tonj North; Aweil West; Aweil East; Renk; Wau; Tonj North; Jur River; Yambio, Budi, Ikotos, Maban and Aweil East, Ikotos, Tonj East, Magwi and Bomaand) and 4 Protection of Civilians Sites POCs (Juba, Bentiu, Malakal and Wau). [WHO, 8 Mar 2020](https://reliefweb.int/node/3557008)


Two months into a measles outbreak in Pibor town in the Greater Pibor Administrative Area, the spread of the highly contagious and life-threatening illness is a growing crisis. On 18 August 2020, MSF treated the first patient for suspected measles in Pibor town, eastern South Sudan. By the end of October, teams had treated over 250 children. [MSF, 3 Nov 2020](https://reliefweb.int/node/3557008)

There has not been any confirmed measles outbreak in South Sudan during the reporting year. [UNICEF, 29 July 2021](https://reliefweb.int/node/3760415)",0,0,0,0,0,0,0,0
