id,name,country,date,description,total_affected,total_injured,total_missing,total_displaced,economic_impact,total_damaged_houses,total_damaged_schools,total_damaged_health_facilities
51266,Uganda: Floods - Jul 2022,Uganda,2022-08-01T12:55:19+00:00,"Heavy rainfall has been affecting the Eastern Region since 30 July, triggering landslides and causing rivers to overflow (in particular the Nabuyonga, and Namatala Rivers) and floods that have resulted in casualties and damage. At least 3,745 households have been affected in the districts of Mbale, Kapchorwa, Sironko and Bulambuli, and Bukedea, with 24 deaths recorded. Joint rapid assessments with Government authorities and partners on the ground are ongoing. The Uganda Red Cross Society is delivering immediate shelter, WASH and health assistance. Over the next 24 hours, more heavy rainfall with locally very heavy rainfall is forecast over the whole country. ([ECHO, 1 Aug 2022](https://reliefweb.int/node/3871628))

Heavy rainfall in the Eastern region of Uganda has caused floods, flash floods, river overflow and landslides, resulting in casualties and damage. The overflow of Nabuyonga, Namatala, Nashibiso and Napwoli Rivers was reported, while the most affected area includes Mbale City. According to media reports, the number of fatalities has increased to 29 people (23 in Mbale City, three in Kapchorwa District and three in Sironko District, all in east Eastern Region). About 80 houses, nine education centers and 14 bridges have been damaged. 4,000 households (approx. 20,000 people) have been affected since 31 July. 5,600 people have been displaced. 400,000 people have been cut off the national water grid. Over the next 24 hours, more rainfall is forecast over parts of the Eastern Region, including over the already affected area. ([ECHO, 5 Aug 2022](https://reliefweb.int/node/3873414))

The weather forecast by the Uganda National Meteorological Authority (UNMA) for the Elgon region for August 2022 has projected enhanced rains for the region with the possibility for the flooding challenges to continue. ([IFRC, 15 Aug 2022](https://reliefweb.int/node/3876613))

Heavy rainfall has been affecting the Western Region since 2 September, triggering landslides and causing floods and flash floods that have resulted in casualties and damage. Media reports, as of 5 September, three fatalities, several people still missing and ten destroyed houses across the Bundibugyo District (west Western Region, bordering northern Democratic Republic of the Congo) due to flash floods and mudslides. In addition, 37 displaced people and eight destroyed houses were reported in the Kisoro District (southern Western Region) due to a number of landslides. Over the next 24 hours, more heavy rainfall is forecast over most of the Country, including most of the already affected Region. ([ECHO, 5 Sep 2022](https://reliefweb.int/node/3883317))",0,0,0,0,0,0,0,0
51252,Sudan: Floods - Jun 2022,Sudan,2022-07-14T09:51:49+00:00,"On 10 July, flash floods triggered by torrential rains in areas south-east of Kassala town have affected an estimated 750 people in the Ashwaei area located in southern parts of Fatu, Al-Aitma and Al-Shuhada neighborhoods. At least five tukuls (huts) in the area were destroyed, according to the Government’s Humanitarian Aid Commission and the Sudanese Red Crescent Society (SRCS) that visited the area recently. In the eastern and northern parts of Al-Shuhada neighbourhood, some houses are still surrounded by water, and other houses are damaged. According to preliminary reports, emergency shelter, non-food relief supplies, and food assistance are the priority needs of the affected families. The area Inter-Sector Coordination Group (ISCG) convened on 13 July 2022 and agreed with sectors to conduct registration, verification of affected people, and the provision of emergency response. ([OCHA, 13 Jul 2022](https://reliefweb.int/node/3865743))

Since the beginning of the rainy season in June, about 19,409 people (numbers yet to be verified) have been affected by heavy rains and flooding so far, mostly in South Kordofan and White Nile, Kassala, and West Darfur state. ([OCHA, 2 Aug 2022](https://reliefweb.int/node/3872128))

Floods and flash floods continue to impact various states in Sudan, resulting in an increasing number of casualties and damage. According to the authorities and humanitarian organisations, as of 15 August, 52 people have died, more than 8,900 houses have been destroyed and another 20,600 damaged in 12 states. About 136,000 people have been affected since May 2022. The floods have also affected 238 health facilities, more than 1,500 water sources and damaged or washed away 1,500 latrines. ([ECHO, 16 Aug 2022](https://reliefweb.int/node/3876781))

Seasonal rains and flash floods have affected about 299,500 people as of 19 September, according to the Government’s Humanitarian Aid Commission (HAC), humanitarian organiыations on the ground and local authorities. The rains and floods have destroyed at least 17,600 homes and damaged another 45,100 in 16 of the 18 states. The National Council for Civil Defence reported that 129 people died and 120 people were injured since the beginning of the rainy season in June.  ([OCHA, 19 Sep 2022](https://reliefweb.int/node/3887620))

The number of people affected by seasonal rains and flash floods across Sudan has remained constant at 349,000 since 26 September, according to the Government’s Humanitarian Aid Commission (HAC), humanitarian organisations on the ground, and local authorities. At least 24,860 homes have been destroyed and 48,250 homes have been damaged in 16 out of the 18 states. The National Council for Civil Defence reports that 146 people died and 122 people were injured since the beginning of the rainy season in June. ([OCHA, 17 Oct 2022](https://reliefweb.int/node/3896836))

About 103,000 people were displaced due to flash floods or riverine flooding during the 2022 rainy season. Most of this displacement (62 per cent) was caused riverine flooding, while 38 per cent was caused by flash flooding. ([OCHA, 23 Feb 2023](https://reliefweb.int/node/3936882))",0,0,0,0,0,0,0,0
51179,Somalia: Rain and Windstorms - May 2022,Somalia,2022-05-10T00:00:00+00:00,"On 12 May 2022, the local government of Galkacyo hosted an inter-agency coordination meeting where they requested assistance from humanitarian partners to address the immediate and urgent humanitarian needs assessed in 18 out of 20 makeshift camps located in the periphery of the city. This is following sudden heavy rains and windstorms which struck North Galkacyo on 10 May, impacting the city of Galkayo and its surrounding areas, which host the camps. The most affected people by this disaster are approximately 4,416 internally displaced people (736 HH) living in 18 of the 20 recorded camps. These 18 camps around Galkayo are home to approximately 40,254 internally displaced persons (IDP) or 6,709 households. ([IFRC, 21 May 2022](https://reliefweb.int/node/3849309))",0,0,0,0,0,0,0,0
51167,South Sudan: Cholera Outbreak - May 2022,South Sudan,2022-05-07T00:00:00+00:00,"The current cholera outbreak in Bentiu, is in an area with a population of 300,000 people living in formal and informal camps. Despite 2 rounds of oral cholera vaccine, transmission is continuing due to population movement and poor conditions. The outbreak has the potential for escalation to at-risk counties (Mayom, Leer, Guit, Mayendit, Pariang, Panyijiar, Juba) due to population movements, floods, and access to safe water and sanitation. There is continued high numbers of acute watery diarrhoea (AWD) since the start of 2022, with an average of 890 cases per week in Bentiu IDP and town, amounting to a total 3,704 AWD cases across 5 health facilities in the IDP camp.  ([UNICEF, 30 April 2022](https://reliefweb.int/node/3853104))

A Cholera outbreak has been declared in Rubkona county, Unity State. The declaration follows the confirmation of cholera in eight cases following tests by the National Public Health Laboratory in Juba. To date, a total of 31 cases including one death have been reported from Rubkona town and Bentiu IDP camp. ([Govt. South Sudan, 7 May 2022](https://reliefweb.int/node/3844649))

Cumulatively, 212 cholera cases have been reported, of which 36 were cholera RDT positive with 15 testing culture positive at the National Reference Laboratory in Juba. One of the RDT positive cases died giving 0.47% case fatality rate (CFR). First round of oral cholera vaccination campaign in Juba ended on 19 June 2022. ([WHO, 22 Jun 2022](https://reliefweb.int/node/3859056))

From 19 March to 14 August 2022, 316 cases and 1 death (CFR 0.33%) have been reported from Unity State and Ruweng Administrative Area, however most cases have been reported from the Bentiu IDP camp (279 cases, 89% of cumulative total). A total of 56 cases have been confirmed positive by RDT for cholera and 29 tested positive for Vibrio cholerae by culture at the National Public Health Laboratory in Juba. Females account for 61% of all cases and children ages 0-4 years have been the most affected age group accounting for 35.7% of all cases. Rubkona county experienced unprecedented floods in 2021 with flood waters persisting up to the end of the current dry season and the flood surface water is often used for bathing and playing. More than 1 million doses of cholera vaccine doses have been administered in 2022 and more vaccination campaigns are being planned.([WHO, 25 Sep 2022](https://reliefweb.int/node/3890986))

More than 1.2 million doses of cholera vaccine doses have been administered in 2022 and more vaccination campaigns are being planned. Among cholera cases, 118 (35.0%) were reported to be vaccinated, 147 (43.6%) were reported to be unvaccinated, and 72 (21.4%) had unknown vaccination status. ([WHO, 26 Oct 2022](https://reliefweb.int/node/3900183))

From 19 March to 20 November 2022, 424 cases and 1 death (CFR 0.2%) have been reported from Unity State and Ruweng Administrative Area, however most cases have been reported from the Bentiu IDP camp (89% of cumulative total). A total of 56 cases have been confirmed positive by RDT for cholera and 29 tested positive for Vibrio cholerae by culture at the National Public Health Laboratory in Juba. Females account for 62% of all cases and children ages 0-4 years have been the most affected age group accounting for 32.3% of all cases. More than 1.58 million doses of cholera vaccine doses have been administered in 2022 and more vaccination campaigns are being planned. ([WHO, 13 Jan 2023](https://reliefweb.int/node/3923806))

From 19 March to 20 November 2022, 424 cases and 1 death (CFR 0.2%) have been reported from Unity State and Ruweng Administrative Area, however, most cases have been reported from the Bentiu IDP camp (89% of cumulative total). A total of 56 cases have been confirmed positive by RDT for cholera and 29 tested positive for Vibrio cholerae by culture at the National Public Health Laboratory in Juba. Females account for 62% of all cases and children ages 0-4 years have been the most affected age group accounting for 32.3% of all cases. More than 1.58 million doses of cholera vaccine doses have been administered in 2022 and more vaccination campaigns are being planned. ([Govt. South Sudan, WHO, 7 Mar 2023](https://reliefweb.int/node/3941763))

On 7 March 2023, the Ministry of health of South Sudan declared cholera outbreak in Malakal, Upper Nile State. From 22 February to 16 April 2023, a total of 980 cases including two deaths (CFR 0.4%) have been reported. Cases were reported from Malakal town and the IDP camp. ([WHO, 27 Apr 2023](https://reliefweb.int/node/3956535))

The outbreak in South Sudan can no longer be considered an active cholera outbreak. This is because the last PCR positive case was reported on 7 March and since then repeat cultures in both Juba and additionally sent to South Africa have not shown any Vibrio cholerae growth, but rather E.coli,
Salmonella and Enterobacter spp. WHO is supporting the country to strengthen its testing capacities and to redirect the response to improving WASH and management of the acute watery diarrhoea cases due to the identified pathogens. South Sudan had reported a cumulative number of 1 027 suspected case and two related deaths (CFR=0.2%) from Malakal Upper Nile State on the side bordering Sudan as of 16 April 2023. ([WHO, 29 May 2023](https://reliefweb.int/node/3968570))",0,0,0,0,0,0,0,0
51177,Tanzania: Cholera Outbreak - Apr 2022,United Republic of Tanzania,2022-04-23T00:00:00+00:00,"On 23 April 2022, the government reported cholera cases in Uvinza DC (Kigoma region) and Tanganyika DC (Katavi region). By 28 April 2022, the outbreak had spread to other areas along the lake shores of Lake Tanganyika with a total of 129 symptomatically suspected cases, of which eight were confirmed. Most of the affected locations are fishing villages with poor sanitation practices that include open defecation and densely populated areas which lack adequate sanitation with poor access to clean and safe water, posing a danger for further spread of the epidemic. Zero fatalities have been reported to date. ([IFRC, 19 May 2022](https://reliefweb.int/node/3848854))

At least 181 cases of cholera have been reported since the government announced the outbreak on 23 April 2022. No fatalities have been reported. The outbreak has spread from the initial locations in the regions of Kigoma and Katavi to other areas along the shores of Lake Tanganyika with a risk of a further spread. More than 40 percent of the cases occurred among children younger than five years of age. Authorities have reacted swiftly and there is an active surveillance system in place. The Ministry of Health has set up a task force within the government. Organisations, such as the Tanzanian Red Cross and UNICEF, are responding with a variety of activities, including water, sanitation, health and hygiene measures, risk communication and community engagement. ([ECHO, 25 May 2022](https://reliefweb.int/node/3850459)

The World Health Organization has provided technical assistance and critical supplies in response to a cholera outbreak in Katavi Region, in north-western Tanzania. The Government of Tanzania reported the outbreak on 18 April 2022 and by 26 June 2022, a total of 211 cases and 6 deaths were reported from Tanganyika district with - a case death rate of 2.9% which is above acceptable rate for an outbreak under control. ([WHO, 29 Jun 2022](https://reliefweb.int/node/3862605)",0,0,0,0,0,0,0,0
51137,Somalia: Urban Fire Incident - Apr 2022,Somalia,2022-04-01T00:00:00+00:00,"A huge fire broke out in the biggest market (Waaheen) of Hargeisa on the evening of 01 April 2022. The fire was so powerful that the Somaliland Fire Protection could only control it 16 hours after, at noon of April 02, with the support of the Ethiopia Somali region fire department. According to the Somaliland fire protection, this was the worst fire experienced in decades [...] As of April 03, SRCS together with the government estimates almost 2,000 shops and stalls were completely ravaged by the fire, 100 buildings destroyed, and some 50 suffering extensive damage. Most houses in the nearby area were made of light materials e.g iron sheets, tarpaulins, etc, amidst some tall concrete buildings. 62 people were rescued from the fire and 28 people were severely injured [...] Fortunately, no death toll was reported as the fire happened on a weekend. Cumulative damage is still to be confirmed with a thorough assessment, but estimations from SRCS and the government (based on the initial rapid assessment) put the number of affected people at over 12,000. This fire, in the heart of Hargeisa and Somaliland's economic centre, has caused immense property and financial loss – estimated at around 1,5-2 billion USD as reported by the mayor of Hargeisa who is a member of the national response committee. Some 10,000 people lost their livelihoods, and many others will be indirectly affected by the trade disruption (farmers, suppliers, traders, among others). ([IFRC, 7 Apr 2022](https://reliefweb.int/node/3835811))",0,0,0,0,0,0,0,0
51197,Djibouti: Drought - Mar 2022,Djibouti,2022-03-03T00:00:00+00:00,"The ongoing drought and compounding regional and international shocks resulting in high price volatility are affecting the food security and nutrition situation in Djibouti. Rural populations in Ali Sabieh, Arta, Obock, Tadjourah and Dikhil are particularly exposed to extreme deprivation and no longer able to cope due to lack of access to main basic services as water, health, and education. Malnutrition rates are almost double from last year in at least one health center visited by DG ECHO in May 2022. Communities report the depletion of livestock assets, loss of body mass index, and lack of milk production followed by death of livestock. According to the latest IPC, approximately 13% of the population (132,000 people) is facing acute food insecurity (IPC3) and is in need of immediate assistance. Projections indicate an increase in food insecurity to 16% of the population by December 2022. ([ECHO, 7 Jun 2022](https://reliefweb.int/node/3854203))

IPC projections for July to December 2022 indicate an increase in the number of acutely food insecure people, likely reaching 192,168 people, representing 16% of analysed population (1.2 million people, which is about the entire country). The number of people in emergency (IPC 4) will likely increase 12,390 people, a 250% rise from the current numbers, while the 179,778 people could be in crisis (IPC 3).

Current IPC analysis for the period of March to June 2022, highlight that approximately 132,000 people, representing 11% of the analysed population (of nearly 1.2 million people), are estimated to be acutely food insecure (IPC Phase 3 and 4). More precisely, an estimated 5,000 people (less than one percent of the population analysed) are estimated to already be in Emergency (IPC Phase 4) and approximately 127,000 people (11% of the population analysed) are in Crisis (IPC Phase 3). ([IFRC, 1 Jul 2022](https://reliefweb.int/node/3862372))

According to the latest Integrated Food Security Phase Classification (IPC), about 285 000 people are estimated to face severe acute food insecurity (IPC Phase 3 [Crisis] and IPC Phase 4 [Emergency]) in the July‑December 2023 period. This figure, which includes about 185,000 people in IPC Phase 3 (Crisis) and 100,000 in IPC Phase 4 (Emergency), amounts to about one‑quarter of the country’s population and it is almost 50 percent higher on a yearly basis.The high prevalence and severity of acute food insecurity and the deterioration of the food security situation are mainly due to the lingering impact of a prolonged and severe drought, which affected livelihoods between late 2020 and early 2023, and resulted in a reduction of livestock numbers by about 50 percent due to widespread deaths, severely constraining incomes and availability of livestock products for pastoralist households.([FAO, 07 Aug 2023](https://reliefweb.int/node/3986886))
### Appeals & Response Plans

- [![IFRC: Djibouti: Hunger Crisis - Emergency Plan of Action (EPoA) DREF Operation no. MDRDJ005 - Cover preview](https://reliefweb.int/sites/default/files/styles/small/public/previews/73/1a/731ac1bc-5a94-449b-8868-2f5478a44abd.png) IFRC: Djibouti: Hunger Crisis - Emergency Plan of Action (EPoA) DREF Operation no. MDRDJ005](https://reliefweb.int/node/3862372)",0,0,0,0,0,0,0,0
51085,Sudan: Kala-azar Outbreak - Feb 2022,Sudan,2022-02-12T00:00:00+00:00,"On 12 February 2022, the Director of the Department of Vector Control at the Ministry of Health (MoH) of Gedaref State released an appeal statement of emergency to control the alarming increase of Visceral Leishmaniasis (Kala-Azar) cases. The report indicated a continuous increase of cases throughout 2022 with 302 cases and 8 deaths only for January compared to the previous year’s showing cumulative data of 2,973 cases with 69 deaths registered in 2021. Historically, Kala-azar (visceral leishmaniasis) is a significant major health problem in Sudan and particularly in Eastern Sudan. Gedaref state has a total population of 1.4 million, spread over 75,000 km. 495,680 individuals in 245 villages are identified to be more at risk. ([IFRC, 7 Mar 2022](https://reliefweb.int/node/3824539))",0,0,0,0,0,0,0,0
51110,Kenya: Yellow Fever and Chikungunya Outbreaks - Jan 2022,Kenya,2022-01-12T00:00:00+00:00,"The current **Yellow Fever** outbreak was first reported in January 2022. The cases were first reported in Merti Sub County of Isiolo County. Kenya Medical Research Institute (KEMRI) has since confirmed 3 positive cases out of 6 samples from the sub-county. As of 23 Jan, a total of 15 patients presenting fever, jaundice, muscle pain and fever pain (13 males and two females) were line-listed; and three deaths were recorded. A total of three cases turned out positive out of six samples analyzed. The majority of the cases are between 11 years-40 years (82.41 and are reported to come from Merti (bordering Wajir) and Garba Tulla (bordering Garissa) sub-counties. Unconfirmed reports later this week have indicated a possibility of new cases in Baringo and Elgeyo Marakwet. The Ministry of Health reported an outbreak and issued an alert on 3 March received to all the 47 counties and initiated a response both at the County and national levels on 4 March. 

As a response, the Ministry of Health is initiating a national vaccination campaign starting with Wajir, Garissa, Marsabit, Meru, Samburu, Elgeyo Marakwet, Baringo, West Pokot, Turkana, Mandera, and Tana River. Yellow fever vaccine is an effective public health prevention intervention and is offered as a scheduled routine vaccine for children aged nine months in four counties in Kenya (Elgeyo Marakwet, West Pokot, Turkana, and Baringo). 

The first cases of **Chikungunya** were reported in mid-February 2022 in Kotulo within Wajir County. Between February 10th and 24th, 23 samples from the suspected cases were collected and analyzed at KEMRI Nairobi laboratory, out of these, five samples tested positive for the Chikungunya virus, this is from the Ministry of health rapid assessment report. A rapid assessment team by MoH and County Government was deployed to the affected area by the Wajir county department of health. The team visited 50 households from different villages that were suspected to be having patients suffering from Chikungunya. The team identified 16 patients with symptoms of Chikungunya disease. The 15 samples were sent to the KEMRI laboratory for investigation. The team has since
line-listed a total of 67 cases in which five are confirmed and 53 are probable cases in which most of the cases are
epidemiologically linked to the confirmed cases from MoH/KEMRI above. Wargadud Ward in Tarbaj Sub-County is
the ward affected by those potential cases. ([IFRC, 23 Mar 2022](https://reliefweb.int/node/3830613))",0,0,0,0,0,0,0,0
50895,Uganda: Floods and Landslides - Sep 2021,Uganda,2021-09-17T00:00:00+00:00,"On 17 September, Uganda Red Cross Society (URCS) through its assessments, reported flooding events affecting the districts of Kapchorwa, Sironko, Mbale, Bukedea, Zombo, Kapelebyong and Katakwi. The floods, landslides and hailstorm episodes affected 07 districts and have left one (1) registered death from Kapchorwa district (male adult), kapsinde sub-county due to landslides, 72 people injured, 597 individuals homeless, 5 individuals hospitalised, 51 individuals evacuated, 308 families displaced, 416 houses completely destroyed, 829 houses partially damaged, 3 health facilities affected due to the floods, 61 water facilities affected and 6 schools have been affected in Bukedea, Kapelebyong, Katakwi and Oyam districts. There is an urgent need to provide household kits and shelter items to the affected communities to support with immediate household needs. Water facilities have been destroyed which has possessed a risk of water-borne diseases such as cholera and typhoid. Prior to above mentioned events and since the beginning of September 2021, many parts of Uganda have been receiving torrential rains which have affected many districts country wide. To date, the prolonged rain events have persisted, and 17 districts have been affected including Kasese, Oyam, Koboko, Yumbe, Katakwi, Bukedea, Kapchorwa, Sironko, Arua, Mbale, Kakumuro, Kibaale, Ibanda, Apac, Kabaale, Zombo and Kapelebyong. ([IFRC, 13 Oct 2021](https://reliefweb.int/node/3782250))

Heavy rains registered during September and early October 2021 have caused several floods, landslides and hailstorms, significantly affecting more than 40,000 individuals living in 17 Districts located in Eastern, Central, Western and West Nile regions. At least 3,620 people have been displaced and are hosted in government schools and community halls near the affected areas awaiting water levels to recede. On 14 October, a landslide reported in Bududa District (Eastern Uganda), affecting 214 individuals (33 households). ([ECHO, 18 Oct 2021](https://reliefweb.int/node/3783486))",0,0,0,0,0,0,0,0
